EVTTITLEATV2502601;Friends of the Republic;;;;;;;;;;;;;x
EVTDESCATV2502601;[From.GetTitledFirstName] has organized several of the most fanantic and loyal Jacobin Fighters under [From.GetHerHis] employ to form the brotherhood of the Friends of the Republic, a society dedicated to the pursuit of excellence through physical labor.;[From.Get_Le_TitledFirstName] a rťuni plusieurs athlťtes et gladiateurs exceptionnels ť son service pour former la confrťrie des Champions de l'Olympe, une sociťtť dťdiťe ť la poursuite de l'excellence par l'exercice physique.\nBien qu'elle repose principalement sur les principes hellťniques, ses portes sont ouvertes ť tout barbare qui montre sa volontť d'apprendre la discipline et de suivre les enseignements des maťtres de l'ťcole.;[From.GetTitledFirstName] beschťftigt mehrere herausragende Athleten und Gladiatoren, um die Bruderschaft der Champions des Olymps zu grťnden, einer Gesellschaft, die sich dem Streben nach Exzellenz durch kťrperliche Arbeit widmet.\nObwohl diese Gesellschaft grťťtenteils auf hellenischen Prinzipien besteht, steht es jedem Barbaren der Bereitschaft zeigt offen, die Disziplin zu lernen und den Lehren der Meister zu folgen.;;[From.GetTitledFirstName] ha empleado a varios atletas y gladiadores excepcionales para formar la hermandad de los Campeones olťmpicos, una sociedad dedicada a la bťsqueda de la excelencia mediante el trabajo fťsico.\nAunque esta sociedad se basa sobre todo en principios helťnicos, tiene las puertas abiertas a cualquier bťrbaro que estť dispuesto a aprender disciplina y seguir las lecciones de los maestros de la escuela.;;;;;;;;;x
EVTOPTAATV2502601;Sounds fun!;Cela a l'air amusantť!;Klinge spaťig!;;ťParece divertido!;;;;;;;;;x
EVTOPTBATV2502601;Bah! This looks suspicious...;Cela a l'air suspect...;Pff... Das sieht verdťchtig aus...;;ťBah! Parece sospechosoť;;;;;;;;;x
create_warrior_lodge_jacobinist;Create the Friends of the Republic.;;;;;;;;;;;;;x
create_warrior_lodge_jacobinist_desc;Only the finest warriors of the Republic can be trusted to care for her safety. As such, it is only fitting to establish a society where the strongest Jacobin warriors can hone their fighting prowess and defend the Revolution.;;;;;;;;;;;;;x
create_warrior_lodge_jacobinist_tooltip;Establish the §YWarrior Society§! of the §YFriends of the Republic§!;;;;;;;;;;;;;x